{
  "id": "wipe-fall", "name": "WiPE-FaLl", "year": 2024,
  "summary": "Wireless CSI amplitude dataset for estimating low, medium, and high fall likelihood from simulated timed up-and-go tests.",
  "tasks": ["fall"], "modalities": ["Wireless CSI amplitude"],
  "hardware": {"platform": "Two USRP X300 software-defined radios with VERT2450 antennas", "chipset": "USRP X300", "wifi_standard": "Custom GNU Radio OFDM", "band": "2.4 GHz"},
  "settings": {"environments": 1, "subjects": 1, "scenario": "One subject performs a 3 m Timed Up-and-Go path in Room 511 under three simulated balance-risk conditions"},
  "scale": {"samples": 1500, "risk_classes": 3, "training_per_class": 475, "unseen_test_per_class": 25},
  "original": {"landing_page": "https://researchdata.gla.ac.uk/1623/", "download_page": "https://researchdata.gla.ac.uk/1623/", "access": "application", "license": "CC BY 4.0; files supplied on request", "redistribution": "allowed", "formats": ["CSV amplitude"]},
  "standardization": {"status": "adapter-ready", "profile": "general-sensing", "native_shape": {"subcarriers": 51, "tx_links": 1, "rx_links": 1}, "notes": "Each official amplitude CSV becomes [T, 51, 1, 1]. Preserve all 51 subcarriers and the single USRP link. The README does not report the CSI sampling rate, so a requested 100 Hz fall-risk view is recorded as a target-grid assumption rather than a measured resampling rate. Preserve the official training versus unseen folder split."},
  "sources": [{"type": "data", "url": "https://researchdata.gla.ac.uk/1623/"}], "verified_at": "2026-07-01"
}
