{
  "id": "wifi-presence-movement", "name": "WiFi CSI and RSS Presence/Movement", "year": 2020,
  "summary": "Long-form antenna-wise CSI and RSS collection with annotations for detecting human presence and movement.",
  "tasks": ["occupancy", "har"], "modalities": ["WiFi CSI", "RSS"],
  "hardware": {"platform": "Intel CSI Tool capture system", "chipset": "Intel 5300", "wifi_standard": "802.11n", "band": null},
  "settings": {"environments": 4, "subjects": null, "scenario": "Ambient presence and movement monitoring in rooms G19, G21, 260, and 128a"},
  "scale": {"size_gb": 28, "example_csi_file_mb": 616},
  "original": {"landing_page": "https://zenodo.org/records/3676058", "download_page": "https://zenodo.org/records/3676058", "access": "direct", "license": "CC BY 4.0", "redistribution": "allowed", "formats": ["Gzipped JSON CSI", "Gzipped CSV RSS", "CSV annotations"]},
  "standardization": {"status": "verified", "profile": "continuous-native", "notes": "Presence and movement use the 100 Hz time rule. Keep 30 subcarriers, 1 Tx, and 3 Rx; output is [T, S, Tx, Rx] per sample."},
  "sources": [{"type": "data", "url": "https://zenodo.org/records/3676058"}], "verified_at": "2026-07-07"
}
