{
  "id": "ntu-fi", "name": "NTU-Fi HAR and Human-ID", "year": 2022,
  "summary": "Paired Atheros-platform benchmarks for six-class human activity recognition and gait-based identification of fourteen people.",
  "tasks": ["har", "identity"], "modalities": ["WiFi CSI amplitude"],
  "hardware": {"platform": "Embedded WiFi sensing system", "chipset": "Atheros CSI Tool", "wifi_standard": "802.11n", "band": null},
  "settings": {"environments": 3, "subjects": 14, "scenario": "HAR in three layouts; gait identity with a T-shirt, coat, or backpack"},
  "scale": {"har_samples": 1200, "human_id_samples": 840, "har_classes": 6, "identity_classes": 14, "shape": "3×114×500"},
  "original": {"landing_page": "https://github.com/xyanchen/WiFi-CSI-Sensing-Benchmark", "download_page": "https://github.com/xyanchen/WiFi-CSI-Sensing-Benchmark", "access": "direct", "license": "Dataset license not stated; official-source fetch only", "redistribution": "unclear", "formats": ["Processed amplitude arrays"]},
  "standardization": {"status": "verified", "profile": "general-sensing", "notes": "Follow SenseFi's official 2000-to-500 packet selection, preserve all 114 subcarriers and three antenna streams as 1 Tx × 3 Rx, and add the official normalized amplitude as a companion array. The 100 Hz task view is an assumed grid because physical packet cadence is absent from the processed files."},
  "sources": [{"type": "repository", "url": "https://github.com/xyanchen/WiFi-CSI-Sensing-Benchmark"}], "verified_at": "2026-06-28"
}
